{
  "schema_version": "1.0.0",
  "niche": "finance",
  "persona": {
    "voice": "rigorous, data-first",
    "stances": [
      "fees and time compound louder than stock picks"
    ],
    "catchphrase": "follow the cash flow",
    "series": [
      {
        "id": "s1",
        "title": "t",
        "cadence": "daily"
      }
    ]
  },
  "brand_kit": {
    "palette": [
      "#0C1E12",
      "#00E5FF"
    ],
    "font": "Inter",
    "logo": "brand/finance.svg"
  },
  "defaults": {
    "voice_backend": "kokoro"
  }
}
